{
  "$schema": "https://json-schema.org/draft/2020-12/schema",
  "$id": "https://wulfquest.invalid/schema/display.schema.json",
  "title": "display.json — AGENTS.md §5.1",
  "type": "object",
  "additionalProperties": false,
  "required": ["schemaVersion", "canvas", "playfield", "panel", "scale", "border", "crt", "spriteFlicker"],
  "properties": {
    "schemaVersion": { "type": "integer", "minimum": 1 },
    "canvas": { "$ref": "#/$defs/size" },
    "playfield": {
      "type": "object",
      "additionalProperties": false,
      "required": ["x", "y", "w", "h", "cell", "cols", "rows"],
      "properties": {
        "x": { "type": "integer", "minimum": 0 },
        "y": { "type": "integer", "minimum": 0 },
        "w": { "type": "integer", "minimum": 1 },
        "h": { "type": "integer", "minimum": 1 },
        "cell": { "type": "integer", "const": 8 },
        "cols": { "type": "integer", "const": 32 },
        "rows": { "type": "integer", "const": 22 }
      }
    },
    "panel": {
      "type": "object",
      "additionalProperties": false,
      "required": ["x", "y", "w", "h"],
      "properties": {
        "x": { "type": "integer", "minimum": 0 },
        "y": { "type": "integer", "minimum": 0 },
        "w": { "type": "integer", "minimum": 1 },
        "h": { "type": "integer", "minimum": 1 }
      }
    },
    "scale": {
      "type": "object",
      "additionalProperties": false,
      "required": ["defaultScale", "min", "max", "integerOnly"],
      "properties": {
        "defaultScale": { "type": "integer", "minimum": 1, "maximum": 12 },
        "min": { "type": "integer", "minimum": 1 },
        "max": { "type": "integer", "minimum": 1, "maximum": 12 },
        "integerOnly": { "type": "boolean" }
      }
    },
    "border": {
      "type": "object",
      "additionalProperties": false,
      "required": ["idleColour", "flashOnEvent"],
      "properties": {
        "idleColour": { "type": "string", "minLength": 1 },
        "flashOnEvent": { "type": "boolean" }
      }
    },
    "crt": {
      "type": "object",
      "additionalProperties": false,
      "required": ["scanlines", "scanlineLuminancePercent", "glow", "glowPercent", "attributeClash"],
      "properties": {
        "scanlines": { "type": "boolean" },
        "scanlineLuminancePercent": { "type": "integer", "minimum": 0, "maximum": 100 },
        "glow": { "type": "boolean" },
        "glowPercent": {
          "description": "AGENTS.md §5.4: how bright the halo around a lit pixel is, of the pixel itself",
          "type": "integer", "minimum": 0, "maximum": 100
        },
        "attributeClash": { "type": "boolean" }
      }
    },
    "spriteFlicker": { "type": "boolean" }
  },
  "$defs": {
    "size": {
      "type": "object",
      "additionalProperties": false,
      "required": ["w", "h"],
      "properties": {
        "w": { "type": "integer", "minimum": 1 },
        "h": { "type": "integer", "minimum": 1 }
      }
    }
  }
}
