{
  "schemaVersion": 1,
  "canvas": { "w": 320, "h": 256 },
  "playfield": { "x": 32, "y": 32, "w": 256, "h": 176, "cell": 8, "cols": 32, "rows": 22 },
  "panel": { "x": 32, "y": 208, "w": 256, "h": 40 },
  "scale": { "defaultScale": 4, "min": 1, "max": 6, "integerOnly": true },
  "border": { "idleColour": "black", "flashOnEvent": true },
  "crt": { "scanlines": false, "scanlineLuminancePercent": 82, "glow": false, "glowPercent": 60, "attributeClash": false },
  "spriteFlicker": false
}
